{"contract_version":"1.0","message_type":"request","request_id":"session-message-1","action":"session.message","payload":{"content":"Anonymous test message","context_id":"context-anonymous","document_fingerprint":"sha256:anonymous-document","generation":1,"panel_instance_id":"panel-anonymous","project_directory":"D:\\RevitTests","role":"user","session_id":"00000000-0000-4000-8000-000000000001"}}
